{
  "$schema": "https://json-schema.org/draft/2020-12/schema",
  "$id": "https://openbp.dev/schemas/connector.schema.json",
  "title": "connector.json",
  "description": "Маніфест конектора для каталогу OpenBP (F6-16, docs/connectors.md §5.1): як встановити MCP-сервер одним кліком.",
  "type": "object",
  "required": ["id", "name", "description", "transport"],
  "properties": {
    "$schema": { "type": "string" },
    "id": {
      "description": "Стабільний ідентифікатор у каталозі; прив'язує встановлений конектор і залежності шаблонів сценаріїв.",
      "type": "string",
      "pattern": "^[a-z0-9][a-z0-9._-]{0,63}$"
    },
    "name": { "description": "Назва нового конектора за замовчуванням.", "type": "string", "minLength": 1 },
    "description": { "description": "Що вміє конектор (одне речення).", "type": "string" },
    "icon": { "description": "Іконка в каталозі: емодзі або коротка позначка.", "type": "string", "maxLength": 8 },
    "transport": { "description": "Транспорт за замовчуванням.", "enum": ["stdio", "http"] },
    "stdio": {
      "description": "Налаштування для stdio: OpenBP запускає процес сам.",
      "type": "object",
      "required": ["command"],
      "additionalProperties": false,
      "properties": {
        "command": { "type": "string", "minLength": 1 },
        "arguments": { "type": "array", "items": { "type": "string" } },
        "environment": { "description": "Несекретні змінні середовища.", "type": "object", "additionalProperties": { "type": "string" } },
        "workingDirectory": { "type": "string" }
      }
    },
    "http": {
      "description": "Налаштування для http: сервер працює окремо (напр. контейнер у тій самій мережі Compose).",
      "type": "object",
      "required": ["url"],
      "additionalProperties": false,
      "properties": {
        "url": { "type": "string", "format": "uri" },
        "headers": { "description": "Несекретні заголовки.", "type": "object", "additionalProperties": { "type": "string" } }
      }
    },
    "credential": {
      "description": "Що покласти в credential конектора: змінні середовища (stdio, тип mcp.stdio) і заголовки (http, тип mcp.http).",
      "type": "object",
      "additionalProperties": false,
      "properties": {
        "env": { "type": "array", "items": { "$ref": "#/$defs/key" } },
        "headers": { "type": "array", "items": { "$ref": "#/$defs/key" } }
      }
    },
    "actions": {
      "description": "Дії (tools) конектора для палітри ще до підключення (F3-92): назви й описи; схему аргументів дає discovery підключення. Імена мають збігатися з tools/list сервера (перевіряє контрактний тест конектора).",
      "type": "array",
      "items": { "$ref": "#/$defs/action" }
    },
    "triggers": {
      "description": "Пресети тригерів конектора для палітри (docs/connectors.md §9.2): готовий вузол mcp.subscribe або mcp.poll без serverId.",
      "type": "array",
      "items": { "$ref": "#/$defs/trigger" }
    }
  },
  "$defs": {
    "action": {
      "type": "object",
      "required": ["name", "title"],
      "additionalProperties": false,
      "properties": {
        "name": { "description": "Ім'я tool'а в tools/list (toolName вузла).", "type": "string", "minLength": 1 },
        "title": { "description": "Назва дії для людини.", "type": "string", "minLength": 1 },
        "description": { "type": "string" }
      }
    },
    "trigger": {
      "type": "object",
      "required": ["id", "title", "node"],
      "additionalProperties": false,
      "properties": {
        "id": { "type": "string", "minLength": 1 },
        "title": { "type": "string", "minLength": 1 },
        "description": { "type": "string" },
        "node": {
          "type": "object",
          "required": ["type", "parameters"],
          "additionalProperties": false,
          "properties": {
            "type": { "type": "string", "enum": ["mcp.subscribe", "mcp.poll"] },
            "parameters": { "type": "object", "description": "Параметри вузла без serverId (підставляє палітра)." }
          }
        }
      }
    },
    "key": {
      "type": "object",
      "required": ["name"],
      "additionalProperties": false,
      "properties": {
        "name": { "type": "string", "minLength": 1 },
        "title": { "type": "string" },
        "required": { "type": "boolean" },
        "secret": { "type": "boolean" }
      }
    }
  }
}
