{
  "$schema": "../../tools/connector-template/schemas/connector.schema.json",
  "id": "gsheets",
  "name": "Google Sheets",
  "description": "Читання й запис рядків Google-таблиць за назвами колонок (сервісний акаунт Google).",
  "icon": "📊",
  "transport": "stdio",
  "stdio": {
    "command": "dotnet",
    "arguments": [
      "/opt/openbp/connectors/gsheets/OpenBP.Connectors.GSheets.dll"
    ]
  },
  "http": {
    "url": "http://gsheets:8080/mcp"
  },
  "credential": {
    "env": [
      {
        "name": "GOOGLE_SERVICE_ACCOUNT_JSON",
        "title": "JSON-ключ сервісного акаунта Google (вміст файлу повністю)",
        "required": true,
        "secret": true
      }
    ],
    "headers": []
  },
  "actions": [
    {
      "name": "append_row",
      "title": "Додати рядок",
      "description": "Додає рядок в кінець аркуша."
    },
    {
      "name": "append_rows",
      "title": "Додати кілька рядків",
      "description": "Додає список рядків в кінець аркуша."
    },
    {
      "name": "read_sheets",
      "title": "Прочитати аркуші",
      "description": "Рядки одного чи кількох аркушів таблиці."
    },
    {
      "name": "update_row",
      "title": "Змінити рядок",
      "description": "Змінює рядок за номером."
    },
    {
      "name": "upsert_row",
      "title": "Додати або змінити рядок",
      "description": "Шукає рядок за ключовою колонкою: змінює або додає новий."
    }
  ],
  "triggers": []
}
